category;article;title;price;discount_price;discount_sign;in_stock;description;brand;url_image
ТВ тюнеры;1102721;ТВ тюнер Signal HD-300;870;653;1;6;"Габариты (мм): 148x95x32; Пульт ДУ; USB; HDMI: 1 шт; композитный; Телетекст; Телегид; Time shift; Запись видео; Разрешение видео: 720p, 1080i, 1080p; DVB-T2 (эфирное); DVB-T (эфирное); Тип: внешний тюнер";Signal;http://magazilla.ru/jpg_zoom1/1102721.jpg
ТВ тюнеры;1102730;ТВ тюнер Signal HD-515;1222;1039;1;5;"Габариты (мм): 130x90x35; Пульт ДУ; USB; HDMI: 1 шт; коаксиальный (SPDIF); композитный; Телетекст; Телегид; Time shift; Запись видео; Разрешение видео: 720p, 1080i, 1080p; DVB-T2 (эфирное); DVB-T (эфирное); Тип: внешний тюнер";Signal;http://magazilla.ru/jpg_zoom1/1102730.jpg
ТВ тюнеры;1102766;ТВ тюнер Signal HD-555;854;854;0;4;"Габариты (мм): 132x75x30; Пульт ДУ; USB; HDMI: 1 шт; коаксиальный (SPDIF); композитный; Телетекст; Телегид; Time shift; Запись видео; Разрешение видео: 720p, 1080i, 1080p; DVB-T2 (эфирное); DVB-T (эфирное); Тип: внешний тюнер";Signal;http://magazilla.ru/jpg_zoom1/1102766.jpg
ТВ тюнеры;1102847;ТВ тюнер Aver Media Live Gamer Extreme;10439;7829;1;6;"Вес (г): 182; Габариты (мм): 145x97x29; USB; HDMI: 2 шт; компонентный; Time shift; Запись видео; Разрешение видео: 720i, 720p, 1080i, 1080p; Тип: устройство видеозахвата";Aver Media;http://magazilla.ru/jpg_zoom1/1102847.jpg http://mzimg.com/big/z1/ff1bnweqgz1.jpg http://mzimg.com/big/01/ff1bnwpya01.jpg http://mzimg.com/big/h1/ff1bnwueqh1.jpg http://mzimg.com/big/71/ff1bnx1ki71.jpg
ТВ тюнеры;1177840;ТВ тюнер BBK SMP021HDT2;832;707;1;10;"Вес (г): 100; Габариты (мм): 105x26x83; Пульт ДУ; USB; HDMI: 1 шт; коаксиальный (SPDIF); композитный; Телетекст; Телегид; Time shift; Запись видео; Разрешение видео: 480i, 480p, 576i, 576p, 720p, 1080i; DVB-T2 (эфирное); DVB-T (эфирное); Тип: внешний тюнер";BBK;http://magazilla.ru/jpg_zoom1/1177840.jpg
